{
  "$schema": "https://json-schema.org/draft/2020-12/schema",
  "$id": "https://schemas.voyagerai.dev/phase2/SearchStaysResult.schema.json",
  "title": "SearchStaysResult",
  "description": "Checkpoint C.0.1 design contract (docs/adr/0003-phase2-checkpoint-c0-serving-contract.md §7/§9) for the shape of ProviderResponseEnvelope.result when provider='inside-airbnb-snapshot' / tool=search_stays. Not yet wired to a production tool. Every field here is either a fixed snapshot fact, a model output, or a deterministic Python computation -- never a live-availability or booking claim. A successful result always contains at least one supported stay with a produced prediction and interval; zero eligible rows is NOT a success (see NO_MATCHING_STAYS, ErrorEnvelope). Each stays[] item nests the existing StayOption under 'stay' and FairPriceEstimate under 'fair_price', both pinned to exactly schema_version 1.1.0 -- a nested 1.0.0 payload can never masquerade as this serving form.",
  "type": "object",
  "properties": {
    "schema_version": {
      "enum": ["1.0.0", "1.1.0"],
      "description": "Checkpoint P.3 (additive): 1.1.0 producers may also emit candidate_universe; every 1.0.0-era consumer/fixture remains valid unchanged since candidate_universe is optional and 1.0.0 responses never include it."
    },
    "snapshot_date": { "type": "string", "format": "date" },
    "dataset_sha256": { "type": "string", "pattern": "^[0-9a-f]{64}$" },
    "bundle_sha256": { "type": "string", "pattern": "^[0-9a-f]{64}$" },
    "model_version": {
      "type": "string",
      "minLength": 1,
      "description": "Same value as every returned item's fair_price.model_version -- present at the top level too so a caller need not inspect stays[0] to learn it."
    },
    "currency": { "const": "TRY" },
    "data_mode": { "const": "historical" },
    "disclaimer": {
      "type": "string",
      "minLength": 1,
      "maxLength": 512,
      "description": "Fixed, server-authored snapshot-data disclaimer. Contract-tested to mention the snapshot and to never claim current availability, a live price, or a booking."
    },
    "predictions_produced": {
      "const": true,
      "description": "Always true on a successful result: every returned stay has a produced prediction by construction (stays has minItems 1, and every item's fair_price is required). A request producing zero eligible rows is NO_MATCHING_STAYS, not a success with predictions_produced=false."
    },
    "ranking_basis": {
      "const": "preliminary_price_value_desc",
      "description": "Checkpoint C.0.1 §1: the only ranking basis search_stays itself ever produces. Never 'deal_score' -- that is System A's final ranking, computed after System B supplies itinerary_accessibility, entirely outside this tool."
    },
    "excluded_row_count": {
      "type": "integer",
      "minimum": 0,
      "description": "Eligible, supported rows dropped because prediction failed unexpectedly for that row. Never silently merged into stays[]."
    },
    "stays": {
      "type": "array",
      "minItems": 1,
      "maxItems": 50,
      "items": { "$ref": "#/$defs/resultItem" }
    },
    "candidate_universe": {
      "type": "object",
      "description": "Checkpoint P.3 (additive, schema_version 1.1.0 only). Present ONLY when a genuinely citywide request (no district_ids) had a hard-filtered candidate set larger than MAX_CANDIDATE_ROWS_SCORED, so a deterministic, district-proportional bounded preselection (largest-remainder apportionment by district_id) was applied before scoring instead of rejecting the request. Never present for a district-filtered request or a citywide request that did not need bounding -- the candidate universe is never silently misrepresented: total_eligible_count always states the TRUE, unbounded hard-filtered count.",
      "properties": {
        "bounded": { "const": true },
        "total_eligible_count": { "type": "integer", "minimum": 1 },
        "scored_count": { "type": "integer", "minimum": 1, "maximum": 5000 },
        "selection_method": { "type": "string", "minLength": 1 }
      },
      "required": ["bounded", "total_eligible_count", "scored_count", "selection_method"],
      "additionalProperties": false
    }
  },
  "required": [
    "schema_version", "snapshot_date", "dataset_sha256", "bundle_sha256", "model_version",
    "currency", "data_mode", "disclaimer", "predictions_produced", "ranking_basis",
    "excluded_row_count", "stays"
  ],
  "additionalProperties": false,
  "$defs": {
    "resultItem": {
      "type": "object",
      "properties": {
        "stay": {
          "description": "StayOption pinned to exactly schema_version 1.1.0 and tightened for search_stays use: room_type/availability_status/snapshot_date become required, and room_type is further restricted to the serving-supported subset only (a result row cannot represent an unsupported room type even by implementation bug).",
          "allOf": [
            { "$ref": "https://schemas.voyagerai.dev/phase1/StayOption.schema.json" },
            { "properties": { "schema_version": { "const": "1.1.0" } }, "required": ["schema_version"] },
            { "required": ["room_type", "availability_status", "snapshot_date"] },
            { "properties": { "room_type": { "enum": ["Entire home/apt", "Private room"] } } }
          ]
        },
        "fair_price": {
          "description": "FairPriceEstimate pinned to exactly schema_version 1.1.0, with interval required -- every returned stay carries both a point prediction and a calibrated interval (Checkpoint C.0.1 §9). scoring_status may still be 'incomplete' (deal_score/components absent) -- that is expected and safe here, since search_stays never uses deal_score for ranking.",
          "allOf": [
            { "$ref": "https://schemas.voyagerai.dev/phase1/FairPriceEstimate.schema.json" },
            { "properties": { "schema_version": { "const": "1.1.0" } }, "required": ["schema_version"] },
            { "required": ["interval"] }
          ]
        },
        "preliminary_capped_price_value": {
          "type": "number",
          "minimum": 0,
          "maximum": 1,
          "description": "The exact preliminary ranking value used for this item (docs/adr/0003-phase2-checkpoint-c0-serving-contract.md §1) -- the already-accepted capped-price-value component applied to fair_price vs. the observed snapshot price only. Not the final deal_score; disclosed in full precision for transparency, never rounded before comparison."
        },
        "estimated_total": {
          "type": "object",
          "description": "Present if and only if the request supplied both check_in and check_out. Never present as an availability claim -- nights x nightly_price only.",
          "properties": {
            "amount_minor_units": { "type": "integer", "minimum": 0 },
            "currency": { "const": "TRY" },
            "nights": { "type": "integer", "minimum": 1 }
          },
          "required": ["amount_minor_units", "currency", "nights"],
          "additionalProperties": false
        },
        "rank": { "type": "integer", "minimum": 1 },
        "warnings": {
          "type": "array",
          "items": { "type": "string", "minLength": 1, "maxLength": 256 }
        }
      },
      "required": ["stay", "fair_price", "preliminary_capped_price_value", "rank"],
      "additionalProperties": false
    }
  }
}
